results/metrics/historico_rf.csv

fold,animais_val,f1_tr,f1_val
1,"['06', '12']",0.9999814565742721,0.780862927497366
2,"['01', '18']",0.9999810474300047,0.8049882461411683
3,"['02', '03', '17']",1.0,0.7913623398831365
4,"['07', '14', '15', '16']",1.0,0.7513305916099527
5,"['05', '08', '09', '13']",0.9999806776434772,0.7542255433762453

docs/relatorio_modelo2.md

## 4. Protocolo de Validação

── Fold 1/5  |  validação: ['06', '12'] ──
  Treino concluído | f1_tr: 1.0000 | f1_val: 0.7809
  → F1 (melhor modelo) fold 1: 0.7809

── Fold 2/5  |  validação: ['01', '18'] ──
  Treino concluído | f1_tr: 1.0000 | f1_val: 0.8050
  → F1 (melhor modelo) fold 2: 0.8050

── Fold 3/5  |  validação: ['02', '03', '17'] ──
  Treino concluído | f1_tr: 1.0000 | f1_val: 0.7914
  → F1 (melhor modelo) fold 3: 0.7914

── Fold 4/5  |  validação: ['07', '14', '15', '16'] ──
  Treino concluído | f1_tr: 1.0000 | f1_val: 0.7513
  → F1 (melhor modelo) fold 4: 0.7513

── Fold 5/5  |  validação: ['05', '08', '09', '13'] ──
  Treino concluído | f1_tr: 1.0000 | f1_val: 0.7542
  → F1 (melhor modelo) fold 5: 0.7542